rank,title,title_english,title_japanese,type,members,score,year
1,Hajime no Ippo,Fighting Spirit,はじめの一歩 THE FIGHTING!,TV,654346,8.78,2000
2,Cardcaptor Sakura Movie 2: Fuuin Sareta Card,Cardcaptor Sakura Movie 2: The Sealed Card,劇場版 カードキャプターさくら 封印されたカード,Movie,120904,8.21,2000
3,Yuusha-Ou GaoGaiGar Final,GaoGaiGar Final,勇者王ガオガイガーFINAL,OVA,12537,8.09,2000
4,FLCL,FLCL,フリクリ,OVA,867455,8.04,2000
5,Meitantei Conan Movie 04: Hitomi no Naka no Ansatsusha,Case Closed Movie 04: Captured In Her Eyes,瞳の中の暗殺者,Movie,67077,8.02,2000
6,Vampire Hunter D (2000),Vampire Hunter D: Bloodlust,バンパイアハンターD,Movie,225670,7.96,2000
7,InuYasha,InuYasha,犬夜叉,TV,835873,7.87,2000
8,Digimon Adventure: Bokura no War Game!,Digimon: Our War Game!,デジモンアドベンチャー ぼくらのウォーゲーム！,Movie,95490,7.8,2000
9,Jin-Rou,Jin-Roh: The Wolf Brigade,人狼 JIN-ROH,Movie,196183,7.78,2000
10,Gakkou no Kaidan,Ghost Stories,学校の怪談,TV,238368,7.75,2000
11,Seikai no Senki,Banner of the Stars,星界の戦旗,TV,35890,7.64,2000
12,Daa! Daa! Daa!,Daa! Daa! Daa!,だぁ! だぁ! だぁ!,TV,27177,7.64,2000
13,Gensoumaden Saiyuuki,Saiyuki,幻想魔伝 最遊記,TV,57820,7.54,2000
14,Aa! Megami-sama! Movie,Ah! My Goddess: The Movie,劇場版　ああっ女神さまっ,Movie,44598,7.54,2000
15,Shoubushi Densetsu Tetsuya,Shoubushi Densetsu Tetsuya,勝負師伝説哲也,TV,11526,7.51,2000
16,Yu☆Gi☆Oh! Duel Monsters,Yu-Gi-Oh!,遊☆戯☆王　デュエルモンスターズ,TV,416250,7.5,2000
17,Ojamajo Doremi Sharp,Ojamajo Doremi Sharp,おジャ魔女どれみ＃,TV,24273,7.46,2000
18,Crayon Shin-chan Movie 08: Arashi wo Yobu Jungle,Crayon Shin-chan Movie 08: Arashi wo Yobu Jungle,映画 クレヨンしんちゃん　嵐を呼ぶジャングル,Movie,9447,7.4,2000
19,Doraemon Movie 21: Nobita no Taiyou Ou Densetsu,Doraemon the Movie: Nobita's the Legend of the Sun King,映画 ドラえもん のび太の太陽王伝説,Movie,12744,7.39,2000
20,Doraemon: Obaachan no Omoide,Doraemon: A Grandmother's Recollections,ドラえもん おばあちゃんの思い出,Movie,4237,7.38,2000
21,Cardcaptor Sakura: Kero-chan ni Omakase!,Cardcaptor Sakura: Leave it to Kero! Theatrical Version,ケロちゃんにおまかせ！,Movie,32701,7.32,2000
22,Love Hina Christmas Special: Silent Eve,Love Hina Christmas Movie,ラブひなクリスマススペシャル ～サイレント・イヴ～,TV Special,59828,7.3,2000
23,Dotto Koni-chan,.Koni-chan,ドッとKONIちゃん,TV,5747,7.29,2000
24,Popee the Performer,Popee the Clown,POPEE the ぱフォーマー,TV,12263,7.27,2000
25,JoJo no Kimyou na Bouken: Adventure,JoJo's Bizarre Adventure (OVA),ジョジョの奇妙な冒険 ADVENTURE,OVA,86348,7.25,2000
26,Digimon Adventure 02,Digimon Adventure 02,デジモンアドベンチャー０２,TV,228856,7.24,2000
27,Meitantei Conan OVA 01: Conan vs. Kid vs. Yaiba - Houtou Soudatsu Daikessen!!,Detective Conan OVA 01: Conan VS KID VS Yaiba,名探偵コナン: コナンvsキッドvsヤイバ 宝刀争奪大決戦!!,OVA,21157,7.23,2000
28,Ojamajo Doremi Sharp Movie,Ojamajo Doremi Sharp Movie,おジャ魔女どれみ♯,Movie,6007,7.2,2000
29,Brigadoon: Marin to Melan,Brigadoon,ブリガドーン まりんとメラン,TV,14995,7.19,2000
30,Ayashi no Ceres,"Ceres, Celestial Legend",妖しのセレス,TV,64952,7.17,2000
31,Boogiepop wa Warawanai,Boogiepop Phantom,ブギーポップは笑わない Boogiepop Phantom,TV,146499,7.15,2000
32,Vandread,Vandread,ヴァンドレッド,TV,88237,7.15,2000
33,One Piece: Umi no Heso no Daibouken-hen,One Piece: Adventure in the Ocean's Navel,ワンピース ルフィ落下!秘境・海のヘソの大冒険,TV Special,40766,7.15,2000
34,Gear Fighter Dendoh,Gear Fighter Dendoh,GEAR戦士 電童,TV,4481,7.15,2000
35,Hidamari no Ki,Tree in the Sun,陽だまりの樹,TV,5510,7.13,2000
36,Seikai no Monshou Special,Seikai no Monshou Special,星界の紋章 総集編,TV Special,3983,7.13,2000
37,Dokidoki♡Densetsu: Mahoujin Guruguru,Magical Circle Guru Guru 2,ドキドキ♡伝説 魔法陣グルグル,TV,4692,7.12,2000
38,Digimon Adventure 02 Movies,Digimon Movie 02 - Digimon Hurricane Touchdown! Supreme Evolution! The Golden Digimentals.,映画 デジモンアドベンチャー０２,Movie,47840,7.1,2000
39,One Piece Movie 01,One Piece: The Movie,ONE PIECE,Movie,148119,7.09,2000
40,Kazemakase Tsukikage Ran,Carried by the Wind: Tsukikage Ran,風まかせ月影蘭,TV,18848,7.09,2000
41,Love Hina,Love Hina,ラブひな,TV,275741,7.09,2000
42,Pokemon Movie 03: Kesshoutou no Teiou Entei,Pokémon 3: The Movie,ポケットモンスター 結晶塔の帝王 ENTEI,Movie,185928,7.09,2000
43,Lupin III: $1 Money Wars,Lupin III: Missed by a Dollar,ルパン三世 1$マネーウォーズ,TV Special,8329,7.09,2000
44,Shin Getter Robo tai Neo Getter Robo,Shin Getter Robo vs. Neo Getter Robo,真ゲッターロボ対ネオゲッターロボ,OVA,7349,7.09,2000
45,Pokemon: Mewtwo! Ware wa Koko ni Ari,Pokémon: Mewtwo Returns,ポケットモンスター ミュウツー! 我ハココニ在リ,TV Special,81468,7.08,2000
46,Escaflowne,Escaflowne: A Girl in Gaea,エスカフローネ,Movie,76106,7.05,2000
47,Seikai no Danshou: Tanjou,Crest of the Stars: Birth,星界の断章 “誕生”,TV Special,9261,7.04,2000
48,Tottoko Hamtarou,Hamtaro,とっとこハム太郎,TV,63312,7.01,2000
49,Yami no Matsuei,Descendants of Darkness,闇の末裔,TV,57961,7.01,2000
50,Jinzou Ningen Kikaider The Animation,Android Kikaider - The Animation,人造人間キカイダーTHE ANIMATION,TV,11080,6.98,2000
