rank,title,title_english,title_japanese,type,members,score,year,image_url
1,Shinseiki Evangelion,Neon Genesis Evangelion,新世紀エヴァンゲリオン,TV,1935710,8.36,1995,https://cdn.myanimelist.net/images/anime/1314/108941.jpg
2,Koukaku Kidoutai,Ghost in the Shell,GHOST IN THE SHELL（攻殻機動隊）,Movie,675561,8.27,1995,https://cdn.myanimelist.net/images/anime/10/82594.jpg
3,Golden Boy,Golden Boy,ゴールデンボーイ,OVA,436066,8.04,1995,https://cdn.myanimelist.net/images/anime/3/62867.jpg
4,Mimi wo Sumaseba,Whisper of the Heart,耳をすませば,Movie,390539,8.22,1995,https://cdn.myanimelist.net/images/anime/1764/138714.jpg
5,Shin Kidou Senki Gundam Wing,Mobile Suit Gundam Wing,新機動戦記ガンダムW,TV,166787,7.67,1995,https://cdn.myanimelist.net/images/anime/9/85497.jpg
7,Slayers,Slayers,スレイヤーズ,TV,149636,7.72,1995,https://cdn.myanimelist.net/images/anime/6/19870.jpg
8,Memories,Memories,MEMORIES（メモリーズ）,Movie,149330,7.72,1995,https://cdn.myanimelist.net/images/anime/9/74781.jpg
11,Fushigi Yuugi,Mysterious Play,ふしぎ遊戯,TV,125490,7.6,1995,https://cdn.myanimelist.net/images/anime/2/20140.jpg
12,Tenchi Muyou!,Tenchi Muyo! Tenchi Universe,天地無用！,TV,85433,7.42,1995,https://cdn.myanimelist.net/images/anime/3/61663.jpg
13,Gunsmith Cats,Gunsmith Cats,ガンスミス キャッツ,OVA,68532,7.4,1995,https://cdn.myanimelist.net/images/anime/11/2769.jpg
14,Romeo no Aoi Sora,Romeo's Blue Skies,ロミオの青い空,TV,54254,8.31,1995,https://cdn.myanimelist.net/images/anime/4/17979.jpg
17,Armitage III,Armitage III,アミテージ・ザ・サード,OVA,38930,6.96,1995,https://cdn.myanimelist.net/images/anime/1398/94072.jpg
18,Magic Knight Rayearth II,Magic Knight Rayearth II,魔法騎士（マジックナイト）レイアース II,TV,36662,7.49,1995,https://cdn.myanimelist.net/images/anime/1336/135527.jpg
19,Gokinjo Monogatari,Neighborhood Stories,ご近所物語,TV,29746,7.67,1995,https://cdn.myanimelist.net/images/anime/11/18195.jpg
20,Street Fighter II V,Street Fighter II: The Animated Series,ストリートファイターII V,TV,29420,7.05,1995,https://cdn.myanimelist.net/images/anime/6/29992.jpg
21,Bishoujo Senshi Sailor Moon SuperS Gaiden: Ami-chan no Hatsukoi,Sailor Moon SuperS Plus: Ami's First Love,美少女戦士セーラームーンSuperS 外伝 亜美ちゃんの初恋,Special,27358,7.32,1995,https://cdn.myanimelist.net/images/anime/10/68371.jpg
22,Slayers: The Motion Picture,Slayers: The Motion Picture,劇場版スレイヤーズ,Movie,26085,7.26,1995,https://cdn.myanimelist.net/images/anime/10/2644.jpg
23,Ai Tenshi Densetsu Wedding Peach,Wedding Peach,愛天使伝説 ウェディングピーチ,TV,25098,6.74,1995,https://cdn.myanimelist.net/images/anime/7/20446.jpg
24,Bishoujo Senshi Sailor Moon SuperS Specials,Sailor Moon SuperS Specials,美少女戦士セーラームーンSuperSスペシャル,Special,25044,7.38,1995,https://cdn.myanimelist.net/images/anime/9/4619.jpg
25,Bakuretsu Hunters,Sorcerer Hunters,爆れつハンター,TV,24432,6.64,1995,https://cdn.myanimelist.net/images/anime/1607/96463.jpg
26,Kaitou Saint Tail,Mysterious Thief Saint Tail,怪盗セイント・テール,TV,22926,7.54,1995,https://cdn.myanimelist.net/images/anime/6/46607.jpg
27,Ranma ½ Super,Ranma ½ Super,らんま１／２　ＳＵＰＥＲ,OVA,21866,7.63,1995,https://cdn.myanimelist.net/images/anime/1071/94957.jpg
28,Shinpi no Sekai El-Hazard,El Hazard: The Magnificent World,神秘の世界エルハザード,OVA,21615,7.24,1995,https://cdn.myanimelist.net/images/anime/1893/128632.jpg
29,Macross Plus Movie Edition,Macross Plus Movie Edition,マクロスプラス　ＭＯＶＩＥ　ＥＤＩＴＩＯＮ,Movie,19571,7.7,1995,https://cdn.myanimelist.net/images/anime/1487/133799.jpg
30,Shinpi no Sekai El-Hazard (TV),El-Hazard: The Wanderers,神秘の世界エルハザード,TV,19509,6.93,1995,https://cdn.myanimelist.net/images/anime/13/24439.jpg
31,Slam Dunk: Shouhoku Saidai no Kiki! Moero Sakuragi Hanamichi,Slam Dunk: Shohoku Maximum Crisis! Burn Sakuragi Hanamichi,スラムダンク 湘北最大の危機！燃えろ桜木花道,Movie,19060,7.52,1995,https://cdn.myanimelist.net/images/anime/1140/94409.jpg
32,Slam Dunk: Hoero Basketman-damashii! Hanamichi to Rukawa no Atsuki Natsu,Slam Dunk: Roar!! Basket Man Spirit,スラムダンク 吠えろバスケットマン魂!!花道と流川の熱き夏,Movie,19005,7.62,1995,https://cdn.myanimelist.net/images/anime/1931/94408.jpg
33,Ike! Ina-chuu Takkyuu-bu,The Ping-Pong Club,行け! 稲中卓球部,TV,18831,7.49,1995,https://cdn.myanimelist.net/images/anime/10/25459.jpg
34,Bio Hunter,Bio Hunter,バイオ・ハンター,OVA,16796,5.95,1995,https://cdn.myanimelist.net/images/anime/11/17896.jpg
35,3x3 Eyes: Seima Densetsu,3x3 Eyes: Legend of the Divine Demon,3×3 EYES聖魔伝説,OVA,16216,6.9,1995,https://cdn.myanimelist.net/images/anime/1288/120666.jpg
36,Keiraku no Houteishiki Level-C,Level-C,快楽の方程式 LEVEL-C,OVA,15615,5.82,1995,https://cdn.myanimelist.net/images/anime/1016/90268.jpg
37,Kishin Douji Zenki,Zenki,鬼神童子ZENKI,TV,15527,6.97,1995,https://cdn.myanimelist.net/images/anime/1014/98589.jpg
38,DNA² OVA,DNA² OVA,D・N・A2～何処かで失くしたあいつのアイツ～ (1995),OVA,14442,6.47,1995,https://cdn.myanimelist.net/images/anime/7/4537.jpg
39,Yuu☆Yuu☆Hakusho: Eizou Hakusho II,Yuu☆Yuu☆Hakusho: Eizou Hakusho II,幽☆遊☆白書Ⅱ: 幽助、蔵魔、飛影、桑原,OVA,14372,7.24,1995,https://cdn.myanimelist.net/images/anime/1784/125696.jpg
40,Fushigi no Kuni no Miyuki-chan,Miyuki-chan in Wonderland,不思議の国の美幸ちゃん,OVA,14130,5.63,1995,https://cdn.myanimelist.net/images/anime/1187/110295.jpg
41,Lupin III: Kutabare! Nostradamus,Lupin III: Farewell to Nostradamus,"ルパン三世『くたばれ!ノストラダムス,』",Movie,12786,7.31,1995,https://cdn.myanimelist.net/images/anime/8/21668.jpg
42,Virtua Fighter,Virtua Fighter,バーチャファイター,TV,12628,7.1,1995,https://cdn.myanimelist.net/images/anime/1234/110241.jpg
43,Marmalade Boy Movie,Marmalade Boy Movie,ママレード・ボーイ (1995),Movie,11894,7.28,1995,https://cdn.myanimelist.net/images/anime/9/4286.jpg
44,Hikyou Tanken Fam & Ihrlie,Ruin Explorers Fam & Ihrie,秘境探検 ファム＆イーリー,OVA,11894,6.67,1995,https://cdn.myanimelist.net/images/anime/1775/92278.jpg
45,H2,H2,Ｈ２[エイチ・ツー],TV,10826,7.23,1995,https://cdn.myanimelist.net/images/anime/1480/105967.jpg
46,Macross 7 Movie: Ginga ga Ore wo Yondeiru!,Macross 7: The Galaxy is Calling Me,劇場版 マクロス７　銀河がオレを呼んでいる！,Movie,10595,6.88,1995,https://cdn.myanimelist.net/images/anime/8/80064.jpg
47,Macross 7 Encore,Macross 7 Encore,マクロス7アンコール,OVA,10386,6.94,1995,https://cdn.myanimelist.net/images/anime/1514/96093.jpg
48,Lesson XX,Lesson XX,Lesson XX,OVA,10261,5.99,1995,https://cdn.myanimelist.net/images/anime/1937/104509.jpg
49,Saber Marionette R,Saber Marionette R,SMガールズ セイバーマリオネットR,OVA,9615,6.53,1995,https://cdn.myanimelist.net/images/anime/1754/135422.jpg
50,Mahou Shoujo Pretty Sammy,Magical Girl Pretty Sammy,魔法少女プリティサミー,OVA,8752,6.37,1995,https://cdn.myanimelist.net/images/anime/13/58561.jpg
